product_id,product_name,original_price,category_id,stock,slug,vendor_id,ratings,date_add,brand,product_description
377207,Moon Chair Foldable and Portable Bone Lazy Chair Outdoor Camping Leisure Table and Chair Backrest Ultralight Fish Chair,1651000.0,242,1000,moon-chair-foldable-and-portable-bone-lazy-chair-outdoor-camping-leisure-table-and-chair-backrest-ultralight-fish-chair,1,4.35,2024-04-16,Dutrieux,
165034,High Brightness LED Light Bracelet Decorative Rechargeable LED Light Glowing Night Running Bracelet for Outdoor Sports Party,647000.0,242,8,high-brightness-led-light-bracelet-decorative-rechargeable-led-light-glowing-night-running-bracelet-for-outdoor-sports-party,2,4.57,2024-06-03,No brand,
1688,5 Pairs Men's Summer Sports Ankle Socks Black White Breathable Mesh Low Cut Socks No Show Cotton Soft Sports Short Socks,526000.0,242,37,5-pairs-men's-summer-sports-ankle-socks-black-white-breathable-mesh-low-cut-socks-no-show-cotton-soft-sports-short-socks,1,4.5,2024-10-08,Tideral,
376736,Portable Folding Chair Foldable 3-Legged Stool Travel Camping Picnic Outdoor Activities Fishing Accessories Leisure Chair,1370000.0,242,499,portable-folding-chair-foldable-3-legged-stool-travel-camping-picnic-outdoor-activities-fishing-accessories-leisure-chair,2,4.3,2024-04-25,Liilaimic,
158028,Gym Gloves Fitness Weight Lifting Gloves Body Building Gloves Sports Training Fitness Cycling Sports Workout Gloves For Men Women M/L/XL,526000.0,242,7,gym-gloves-fitness-weight-lifting-gloves-body-building-gloves-sports-training-fitness-cycling-sports-workout-gloves-for-men-women-m/l/xl,2,3.97,2024-04-17,No brand,
221780,Gym Gloves Fitness Weight Lifting Gloves Body Building Gloves Sports Training Fitness Cycling Sports Workout Gloves For Men Women M/L/XL,1096000.0,242,9985,gym-gloves-fitness-weight-lifting-gloves-body-building-gloves-sports-training-fitness-cycling-sports-workout-gloves-for-men-women-m/l/xl,1,4.19,2024-10-09,Oimg,
239019,Vintage Nurburgring Rally Road Sports Car Forest Road Landscape Art Poster Canvas Painting Wall Print Room Home Decor,5143000.0,242,888,vintage-nurburgring-rally-road-sports-car-forest-road-landscape-art-poster-canvas-painting-wall-print-room-home-decor,1,2.0,2024-02-29,No brand,
205431,Waterproof Nylon Tote Bag Women Leisure Large Capacity Dumpling Shoulder Bag Women's Handbag Travel Mom Bag Women's Gym Bag,1559000.0,242,100,waterproof-nylon-tote-bag-women-leisure-large-capacity-dumpling-shoulder-bag-women's-handbag-travel-mom-bag-women's-gym-bag,2,5.0,2024-09-26,No brand,
1934,Anti Slip Silicone Yoga Socks Fitness Cotton Socks Mid-Leg Yoga Socks Pilates Gym Floor Sports Socks Indoor Sports Athletic,1630000.0,242,45,anti-slip-silicone-yoga-socks-fitness-cotton-socks-mid-leg-yoga-socks-pilates-gym-floor-sports-socks-indoor-sports-athletic,1,4.67,2024-04-17,No brand,
122832,Japanese School Uniform Girls Sportswear Cute Anime Cosplay Costume JK Sports Cheerleading Volleyball Costume,1979000.0,242,200,japanese-school-uniform-girls-sportswear-cute-anime-cosplay-costume-jk-sports-cheerleading-volleyball-costume,2,4.15,2024-03-14,No brand,
84429,1200Ml Large Capacity Gradient Sports Cup Colorful Combination Cup Large Capacity Hiking Cup Sports Water Cup,526000.0,242,299,1200ml-large-capacity-gradient-sports-cup-colorful-combination-cup-large-capacity-hiking-cup-sports-water-cup,2,0.0,2024-11-05,No brand,
90944,2023 Spring Autumn Men's and Women's Sports Hoodie Hooded Pullover Solid Color Sweatshirt Sportswear Top,1903000.0,242,664,2023-spring-autumn-men's-and-women's-sports-hoodie-hooded-pullover-solid-color-sweatshirt-sportswear-top,1,0.0,2024-05-30,Nsangu,
224715,Gym Gloves Fitness Weight Lifting Gloves Body Building Gloves Sports Training Fitness Cycling Sports Workout Gloves For Men Women M/L/XL,837000.0,242,32,gym-gloves-fitness-weight-lifting-gloves-body-building-gloves-sports-training-fitness-cycling-sports-workout-gloves-for-men-women-m/l/xl,1,4.64,2024-10-13,No brand,
375721,Children's Outdoor Sports Glasses Sports Eyewear Basketball Soccer Glasses Explosion-Proof Impact-Proof Eye Protection Glasses,708000.0,242,4,children's-outdoor-sports-glasses-sports-eyewear-basketball-soccer-glasses-explosion-proof-impact-proof-eye-protection-glasses,1,4.4,2024-02-07,No brand,
119722,Korean Children's Sports Pants Kids Boys Girls Toddler Pants Pull On Loose Pants Sportswear Oversize Pants Jogger Pants,526000.0,242,63,korean-children's-sports-pants-kids-boys-girls-toddler-pants-pull-on-loose-pants-sportswear-oversize-pants-jogger-pants,1,4.6,2024-04-05,Fmpdc,
36803,Mens Classic Black Pullover Hoodie Mens Sportswear Hoodie Loose Long Sleeve Sports Pullover Clothing,893000.0,242,997,mens-classic-black-pullover-hoodie-mens-sportswear-hoodie-loose-long-sleeve-sports-pullover-clothing,1,2.86,2024-08-31,Realxizi,
223808,"Duck Car Decoration, Black Duck Car Dashboard Decoration Duck Bike Horn with Propeller Helmet for Outdoor Sports",612000.0,242,12,"duck-car-decoration,-black-duck-car-dashboard-decoration-duck-bike-horn-with-propeller-helmet-for-outdoor-sports",1,4.43,2024-03-09,No brand,
235588,Pink Letter Pattern Tote Bag Women's Shoulder Bag Sports Sports Tote Bag Nylon Fabric Bag Women's Handbag,1507000.0,242,37,pink-letter-pattern-tote-bag-women's-shoulder-bag-sports-sports-tote-bag-nylon-fabric-bag-women's-handbag,1,4.46,2024-06-12,Ee,
53356,2023 Winter New Women's Coat Female Warm Fashion Leisure Thick Loose Solid Casual Sweet All-match Detachable Collar Z540,2934000.0,242,200,2023-winter-new-women's-coat-female-warm-fashion-leisure-thick-loose-solid-casual-sweet-all-match-detachable-collar-z540,1,4.26,2024-08-03,Liangfeitong,
378107,Outdoor Fishing Chair Aluminum Alloy Oxford Fabric Folding Chair Camping Hiking Foldable Leisure Chair Fishing BBQ Chair Stool,6770000.0,242,24,outdoor-fishing-chair-aluminum-alloy-oxford-fabric-folding-chair-camping-hiking-foldable-leisure-chair-fishing-bbq-chair-stool,2,5.0,2024-10-15,No brand,
377072,Outdoor Folding Chair Ultralight Aluminum Alloy Portable Camping Leisure Reclining Beach Fishing Chair 4 Gear Adjustable Chair,16986000.0,242,200,outdoor-folding-chair-ultralight-aluminum-alloy-portable-camping-leisure-reclining-beach-fishing-chair-4-gear-adjustable-chair,2,4.09,2024-03-18,No brand,
659,"1 Pair Mid Calf Sports Socks for Cycling Running, Breathable Sweat-Absorbent Sports Socks for Men and Women",687000.0,242,124,"1-pair-mid-calf-sports-socks-for-cycling-running,-breathable-sweat-absorbent-sports-socks-for-men-and-women",2,4.95,2024-01-03,No brand,
211790,Women's Sports Bra Crop Top Yoga Top Front Zipper Plus Size Adjustable Straps Shockproof Fitness Sports Bralette Women Underwear,1375000.0,242,10,women's-sports-bra-crop-top-yoga-top-front-zipper-plus-size-adjustable-straps-shockproof-fitness-sports-bralette-women-underwear,2,4.48,2024-04-28,Whoslady,
1775,2 Pairs Men's Running Compression Socks Suitable For Varicose Veins Soccer Football Socks 30 Mmhg Sports Men Women Sports,1630000.0,242,94,2-pairs-men's-running-compression-socks-suitable-for-varicose-veins-soccer-football-socks-30-mmhg-sports-men-women-sports,2,4.66,2024-11-01,No brand,
1712,"3 pairs of high quality breathable sports socks suitable for running, mountain biking and outdoor sports",1630000.0,242,43,"3-pairs-of-high-quality-breathable-sports-socks-suitable-for-running,-mountain-biking-and-outdoor-sports",2,4.81,2024-03-20,Peiresa,
256200,Striped Baseball Cap For Men Women Casual Adjustable Hat Outdoor Sports Sunhat Baseball Cap Sunhat Sports Hat Baseball Cap Cap,908000.0,242,298,striped-baseball-cap-for-men-women-casual-adjustable-hat-outdoor-sports-sunhat-baseball-cap-sunhat-sports-hat-baseball-cap-cap,1,5.0,2024-08-29,Luxxeton,
221474,Gym Gloves Fitness Weight Lifting Gloves Body Building Gloves Sports Training Fitness Cycling Sports Workout Gloves For Men Women M/L/XL,838000.0,242,999,gym-gloves-fitness-weight-lifting-gloves-body-building-gloves-sports-training-fitness-cycling-sports-workout-gloves-for-men-women-m/l/xl,1,3.4,2024-02-13,Dutrieux,
222995,Gym Gloves Fitness Weight Lifting Gloves Body Building Gloves Sports Training Fitness Cycling Sports Workout Gloves For Men Women M/L/XL,774000.0,242,28,gym-gloves-fitness-weight-lifting-gloves-body-building-gloves-sports-training-fitness-cycling-sports-workout-gloves-for-men-women-m/l/xl,1,4.67,2024-08-29,No brand,
24071,New girl refrigerator model elementary school student schoolbag junior high school leisure girl shoulder bag decompression wate,6547000.0,242,13,new-girl-refrigerator-model-elementary-school-student-schoolbag-junior-high-school-leisure-girl-shoulder-bag-decompression-wate,2,4.89,2024-10-26,No brand,
3298,Plus Size Compression Socks Solid Color Men Women Sports Running Yoga Extra Size Fat Socks For Sports Weight Loss 2XL-7XL,526000.0,242,50,plus-size-compression-socks-solid-color-men-women-sports-running-yoga-extra-size-fat-socks-for-sports-weight-loss-2xl-7xl,2,4.22,2024-03-20,No brand,
224892,"Lovely Squeeze Duck Car Bicycle Horn Decoration, Silicone Elastic Belt Easy Install Bicycle Bell for Kids Outdoor Sports",667000.0,242,60,"lovely-squeeze-duck-car-bicycle-horn-decoration,-silicone-elastic-belt-easy-install-bicycle-bell-for-kids-outdoor-sports",2,4.38,2024-04-20,No brand,
34941,Mens Running Compression T-Shirt Women Short Sleeve Sports Tee Gym Fitness T Shirt Mens Running Fit Shirt Homme Sportswear Premium Shirt,526000.0,242,7,mens-running-compression-t-shirt-women-short-sleeve-sports-tee-gym-fitness-t-shirt-mens-running-fit-shirt-homme-sportswear-premium-shirt,2,4.75,2024-10-10,Shedao,
144024,UNO TOM AND JERRY Matching Card Game SHOWEM Multiplayer Family Party Boardgame Fun Friends Entertainment Puzzle Poker,1630000.0,242,17,uno-tom-and-jerry-matching-card-game-showem-multiplayer-family-party-boardgame-fun-friends-entertainment-puzzle-poker,1,4.86,2024-08-16,Uno,
199514,Large Size MM Yoga Running Sports Panties No Steel Ring Hollow Mesh Breathable New Sports Bra Women's Underwear,929000.0,242,84,large-size-mm-yoga-running-sports-panties-no-steel-ring-hollow-mesh-breathable-new-sports-bra-women's-underwear,1,3.8,2024-02-16,No brand,
137313,Weird Puss Fitness Jumpsuit Women Long Sleeve Zipper Sportswear Active Skinny Solid Spring Casual Streetwear Slim Athletic Workout Overalls,2601000.0,242,10,weird-puss-fitness-jumpsuit-women-long-sleeve-zipper-sportswear-active-skinny-solid-spring-casual-streetwear-slim-athletic-workout-overalls,2,4.5,2024-07-28,Weird puss,
192404,Loose Bound Leg Running Sports Jogger Pants Women Quick Dry Sports Gym Fitness Long Sweat Absorbent 2 Side Pockets Workout Pants,1712000.0,242,5,loose-bound-leg-running-sports-jogger-pants-women-quick-dry-sports-gym-fitness-long-sweat-absorbent-2-side-pockets-workout-pants,2,4.23,2024-02-02,No brand,
210626,Solid Color Waterproof Beach Bag Outdoor Sports Handbag Portable Travel Boat School Pool Sports Tote Bag,5916000.0,242,102,solid-color-waterproof-beach-bag-outdoor-sports-handbag-portable-travel-boat-school-pool-sports-tote-bag,1,5.0,2024-07-11,No brand,
158947,Cycling Gloves Half Finger Cycling Anti-Slip Summer Sports Outdoor Cycling Women's Sports Gloves Gym Fitness Fingerless Cycling Gloves,526000.0,242,730,cycling-gloves-half-finger-cycling-anti-slip-summer-sports-outdoor-cycling-women's-sports-gloves-gym-fitness-fingerless-cycling-gloves,2,5.0,2024-03-04,No brand,
376270,Outdoor Ultralight Folding Camping Chair Picnic Hiking Travel Leisure Foldable Backpack Fishing Portable Beach Chair Moon Chair,2423000.0,242,2,outdoor-ultralight-folding-camping-chair-picnic-hiking-travel-leisure-foldable-backpack-fishing-portable-beach-chair-moon-chair,1,5.0,2024-09-12,No brand,
626,10 Pairs Men's High Quality Ankle Socks Breathable Cotton Sports Mesh Summer Sneakers Thin Short Cut Sokken Size 38-45,1597000.0,242,10,10-pairs-men's-high-quality-ankle-socks-breathable-cotton-sports-mesh-summer-sneakers-thin-short-cut-sokken-size-38-45,1,4.76,2024-03-19,Zycsnh,
164487,750ml Hydrating Drink for Facial Cleanser You can do it with your,1630000.0,242,20,750ml-hydrating-drink-for-facial-cleanser-you-can-do-it-with-your,2,4.83,2024-04-17,No brand,
133190,New Spring Fall Baby Boys Kids Clothes Baby Girls Fashion Toddler Pants Sports Casual Wear Infant Sportswear,984000.0,242,7,new-spring-fall-baby-boys-kids-clothes-baby-girls-fashion-toddler-pants-sports-casual-wear-infant-sportswear,2,5.0,2024-07-13,Byaxbxya,
225346,Gym Gloves Fitness Weight Lifting Gloves Body Building Gloves Sports Training Fitness Cycling Sports Workout Gloves For Men Women M/L/XL,875000.0,242,42,gym-gloves-fitness-weight-lifting-gloves-body-building-gloves-sports-training-fitness-cycling-sports-workout-gloves-for-men-women-m/l/xl,2,4.67,2024-09-24,No brand,
368386,Santic Cycling Glasses Mountain Bike Bicycle Cycling Sports Sun Visor Polarized Goggles Outdoor Sports Sunglasses,17344000.0,242,50,santic-cycling-glasses-mountain-bike-bicycle-cycling-sports-sun-visor-polarized-goggles-outdoor-sports-sunglasses,2,3.0,2024-10-26,Santic,
3087,6 Pairs/Lot 2024 New Anti-Slip Tapedesign Mid-Calf Soccer Socks Anti-Slip Soccer Sports Cycling Athletic Men Women Sock EU38-44,834000.0,242,347,6-pairs/lot-2024-new-anti-slip-tapedesign-mid-calf-soccer-socks-anti-slip-soccer-sports-cycling-athletic-men-women-sock-eu38-44,2,4.73,2024-09-04,Gioio,
219444,Little Golden Man Statue Children's Cup Competition Award Medal Home Decor Figurines Ornaments,526000.0,242,21,little-golden-man-statue-children's-cup-competition-award-medal-home-decor-figurines-ornaments,2,4.34,2024-04-29,No brand,
1897,Professional Sports Socks High Quality Brand Breathable Socks Road Cycling Socks For Men And Women Outdoor Sports Racing Cycling Socks,1630000.0,242,35,professional-sports-socks-high-quality-brand-breathable-socks-road-cycling-socks-for-men-and-women-outdoor-sports-racing-cycling-socks,1,4.83,2024-05-11,No brand,
51121,CUTIES Front Cover Yoga Fitness Set Women High Waist Booty Chew Leggings Workout Clothes Purple Sports Bra Gym Sportswear Matching Tops,2714000.0,242,176,cuties-front-cover-yoga-fitness-set-women-high-waist-booty-chew-leggings-workout-clothes-purple-sports-bra-gym-sportswear-matching-tops,1,0.0,2024-05-11,Cozok,
222014,Creative Cruise Ship Liquid Floating Bottle Desktop Decoration Decompression Hourglass Car Ornament Birthday Gift Decoration,1804000.0,242,6,creative-cruise-ship-liquid-floating-bottle-desktop-decoration-decompression-hourglass-car-ornament-birthday-gift-decoration,1,4.0,2024-09-16,Dkstinye,
149695,Metal 3D Puzzle Solving Puzzle Toys Unlocking Lock Ring Children Adults Puzzle Game Entertainment Puzzle Game,1630000.0,242,594,metal-3d-puzzle-solving-puzzle-toys-unlocking-lock-ring-children-adults-puzzle-game-entertainment-puzzle-game,2,4.67,2024-05-12,No brand,
32049,New Sports Headband Bluetooth Music Eye Mask Bluetooth Sleep Eye Mask Sports Headband Call Yoga Headband Headband,1630000.0,242,10,new-sports-headband-bluetooth-music-eye-mask-bluetooth-sleep-eye-mask-sports-headband-call-yoga-headband-headband,1,4.25,2024-08-26,Airsidun,
150263,Children's toy rabbit mini seesaw entertainment game balance toy,1113000.0,242,9,children's-toy-rabbit-mini-seesaw-entertainment-game-balance-toy,2,5.0,2024-06-21,Ggbell,
141322,1 Set Foldable Magnetic Flying Chessboard Game Parent-Child Camping Party Game Toys Indoor Outdoor Entertainment Toys For Kids Adults,1630000.0,242,996,1-set-foldable-magnetic-flying-chessboard-game-parent-child-camping-party-game-toys-indoor-outdoor-entertainment-toys-for-kids-adults,2,3.0,2024-07-01,No brand,
50943,New Men's Tracksuit Spring Autumn Two Piece Set Plus Size Outfits Hooded Sweatshirt + Solid Color Track Pants Women's Warm Suit,2128000.0,242,695,new-men's-tracksuit-spring-autumn-two-piece-set-plus-size-outfits-hooded-sweatshirt-+-solid-color-track-pants-women's-warm-suit,1,0.0,2024-05-15,Xftorginal,
221808,"Car Decoration Black Duck Squeeze Bicycle Horn with Helmet Lanyard, Silicone Elastic Strap Bicycle Bell for Kids Outdoor Sports",633000.0,242,470,"car-decoration-black-duck-squeeze-bicycle-horn-with-helmet-lanyard,-silicone-elastic-strap-bicycle-bell-for-kids-outdoor-sports",2,4.61,2024-08-29,No brand,
105028,Sports Headbands for Men Women Gym Yoga Sweat Elastic Hair Bands Soft Elastic Hairbands Outdoor Sports Sweat Absorbent,526000.0,242,100,sports-headbands-for-men-women-gym-yoga-sweat-elastic-hair-bands-soft-elastic-hairbands-outdoor-sports-sweat-absorbent,1,4.73,2024-03-16,Cellot,
233083,Creative Cruise Ship Liquid Drift Bottle Desktop Decoration Birthday Gift Decompression Decoration Hourglass Car Decoration Gift,1745000.0,242,199,creative-cruise-ship-liquid-drift-bottle-desktop-decoration-birthday-gift-decompression-decoration-hourglass-car-decoration-gift,2,3.0,2024-10-11,No brand,
138513,New Spring Autumn Winter Baby Girls Kids Clothes Boys Children Fashion Pants Toddler Pants Casual Sports Infant Sportswear,526000.0,242,6,new-spring-autumn-winter-baby-girls-kids-clothes-boys-children-fashion-pants-toddler-pants-casual-sports-infant-sportswear,1,4.21,2024-02-17,Byaxbxya,
238236,Kids Digital Sports Camera 1080P Sports Video Recorder for Kids Dual Lens HD Kids Digital Video Camera Kids Action Camera,2390000.0,242,999,kids-digital-sports-camera-1080p-sports-video-recorder-for-kids-dual-lens-hd-kids-digital-video-camera-kids-action-camera,2,4.22,2024-01-12,No brand,
233363,Leisure Business Travel Bag Large Capacity Fashion Canvas Handbag Briefcase,3510000.0,242,68,leisure-business-travel-bag-large-capacity-fashion-canvas-handbag-briefcase,2,5.0,2024-03-27,Muchuan,
156245,Sexy Tank Top with Built-in Sports Bra for Women Corset Tank Top Bra for Gym Women Pad Sports Tank Top Yoga Push Up Bralette,679000.0,242,10,sexy-tank-top-with-built-in-sports-bra-for-women-corset-tank-top-bra-for-gym-women-pad-sports-tank-top-yoga-push-up-bralette,1,4.3,2024-02-17,Moonbiffy,
248545,New Network Red Fashion Leisure Lingge Embroidery Hook Tassel Decoration Strap Small Square Bag Shoulder Bag,1345000.0,242,1000,new-network-red-fashion-leisure-lingge-embroidery-hook-tassel-decoration-strap-small-square-bag-shoulder-bag,2,3.71,2024-07-28,No brand,
377520,"Mazza Folding Leather Chair For Camping, Car Seat, Self-driving, Entertainment, Camping Accessories",7500000.0,242,518,"mazza-folding-leather-chair-for-camping,-car-seat,-self-driving,-entertainment,-camping-accessories",2,0.0,2024-07-04,No brand,
205693,Outdoor Travel Men's Fashion CrossBorder Polyester Shoulder Bag Small Chest Trend Entertainment,1630000.0,242,1,outdoor-travel-men's-fashion-crossborder-polyester-shoulder-bag-small-chest-trend-entertainment,2,4.23,2024-03-06,No brand,
217424,Unpacking Lucky Cat Drum Block Wooden Fish Temple Decorative Block Knocking Percussion Toy Buddhist Meditation Decoration,1630000.0,242,199,unpacking-lucky-cat-drum-block-wooden-fish-temple-decorative-block-knocking-percussion-toy-buddhist-meditation-decoration,1,4.35,2024-07-30,Vktech,
193027,New Fleece Sports Pants Women's Winter Warm Pants Ankle Length Pants Fashion Protective Pants Casual Sports Pants Thick Warm Pants Leggings,2670000.0,242,16,new-fleece-sports-pants-women's-winter-warm-pants-ankle-length-pants-fashion-protective-pants-casual-sports-pants-thick-warm-pants-leggings,1,5.0,2024-10-07,Infiher,
158543,Montessori Materials DIY Sports Posture Puzzle Toy With 24 Faceted Cards For Kids Intelligence Early Education Gift Toys,526000.0,242,58,montessori-materials-diy-sports-posture-puzzle-toy-with-24-faceted-cards-for-kids-intelligence-early-education-gift-toys,1,4.71,2024-09-02,No brand,
59175,New Cotton Spandex Pajamas Set Women Kawaii Fashion Sleepwear For Girls Leisure Shorts Nightgown Bow Decoration Pijamas,2522000.0,242,498,new-cotton-spandex-pajamas-set-women-kawaii-fashion-sleepwear-for-girls-leisure-shorts-nightgown-bow-decoration-pijamas,2,0.0,2024-11-09,No brand,
171069,1PC Children Half Finger Gloves Breathable Sports Gloves Anti-Slip Gel Gloves For Kids Cycling Cycling Outdoor Sports,526000.0,242,499,1pc-children-half-finger-gloves-breathable-sports-gloves-anti-slip-gel-gloves-for-kids-cycling-cycling-outdoor-sports,1,5.0,2024-05-21,No brand,
230921,Outdoor Large Capacity Gym Bag 55L 100L 150L Travel Gym Bag Waterproof Weekend Sports Bag,2836000.0,242,13,outdoor-large-capacity-gym-bag-55l-100l-150l-travel-gym-bag-waterproof-weekend-sports-bag,2,4.92,2024-07-12,No brand,
123161,C045 Elementary School Garden Uniform Sportswear Casual Suits,4214000.0,242,6999,c045-elementary-school-garden-uniform-sportswear-casual-suits,2,4.42,2024-06-30,No brand,
367625,Basketball Goggles Sports Goggles Soccer Soccer Anti-collision Men's Glasses,1151000.0,242,9999,basketball-goggles-sports-goggles-soccer-soccer-anti-collision-men's-glasses,1,4.17,2024-09-08,No brand,
157682,MMA Training WWE T Shirt UFC Men's Clothing Tracksuit Short Sleeve 2 Piece Set Sportswear Oversized Clothing Boxing Shirt,2626000.0,242,199,mma-training-wwe-t-shirt-ufc-men's-clothing-tracksuit-short-sleeve-2-piece-set-sportswear-oversized-clothing-boxing-shirt,1,4.75,2024-06-20,No brand,
119693,Women's Leisure Jumpsuit 2024 Newest Spring/Summer Color Coated Wide Leg Suspender Bodysuit,1493000.0,242,10,women's-leisure-jumpsuit-2024-newest-spring/summer-color-coated-wide-leg-suspender-bodysuit,2,4.14,2024-09-08,Chaxiaoa,
266206,Fashion Multicolor Polka Dot Printed Canvas Women Crossbody Bag Trendy Shoulder Nylon Leisure Messenger Bag,1113000.0,242,2416,fashion-multicolor-polka-dot-printed-canvas-women-crossbody-bag-trendy-shoulder-nylon-leisure-messenger-bag,1,3.86,2024-08-11,Noenname_null,
377477,Dikecloud Outdoor Ultralight Portable Camping Chair Moon Chair ALUMINUM Alloy Leisure Backrest Chair with Pillow Seat,3999000.0,242,75,dikecloud-outdoor-ultralight-portable-camping-chair-moon-chair-aluminum-alloy-leisure-backrest-chair-with-pillow-seat,2,4.29,2024-08-27,Aotu,
36862,ASTROWORLD WISH YOU WERE HERE Print Unisex Men's Sports Hoodie Casual Design Fleece Sweatshirt Sportswear Top Casual Pullover,1028000.0,242,888,astroworld-wish-you-were-here-print-unisex-men's-sports-hoodie-casual-design-fleece-sweatshirt-sportswear-top-casual-pullover,1,4.11,2024-03-25,No brand,
44650,2024 New Autumn Winter Fashion Women's Leisure Jacquard Large Size Hooded Sweater,2110000.0,242,4,2024-new-autumn-winter-fashion-women's-leisure-jacquard-large-size-hooded-sweater,1,0.0,2024-05-26,Suit set,
87713,1pc-Handheld Plastic Basketball Multi-Function Sports Water Fountain Cup,1413000.0,242,99,1pc-handheld-plastic-basketball-multi-function-sports-water-fountain-cup,2,0.0,2024-07-23,No brand,
246946,Momo Cashmere Pony Chair Celebrity Solo Sofa Leisure Low Stool Household Animal Chair Stool Decorative Nordic Pony Chair,9647000.0,242,3542,momo-cashmere-pony-chair-celebrity-solo-sofa-leisure-low-stool-household-animal-chair-stool-decorative-nordic-pony-chair,1,5.0,2024-01-29,Uosu,
209988,Men Large Capacity Canvas Travel Men Fitness Sports Workout Handbag Shoes Bag Black Khaki Bag XA32M,2622000.0,242,881,men-large-capacity-canvas-travel-men-fitness-sports-workout-handbag-shoes-bag-black-khaki-bag-xa32m,2,3.5,2024-05-12,Scione,
178870,Mattel UNO DOS Card Games Family Fun Entertainment Board Games Poker Kids Toys Card Games,1003000.0,242,60,mattel-uno-dos-card-games-family-fun-entertainment-board-games-poker-kids-toys-card-games,1,4.1,2024-04-01,Takara tomy,
124726,2024 NEW USA Men's Sports Fitness Basketball Running Quick Dry Summer Mesh Training Quarter Pants,526000.0,242,197,2024-new-usa-men's-sports-fitness-basketball-running-quick-dry-summer-mesh-training-quarter-pants,2,4.32,2024-11-10,Inakapower,
173827,Touch ID Woman Laptop Windows 10 11 Office Education Gaming Laptop 16.0” IPS 11th N5095 12G RAM 512G SSD + 1000G HHD Narrow Side,17922000.0,238,17,touch-id-woman-laptop-windows-10-11-office-education-gaming-laptop-16.0”-ips-11th-n5095-12g-ram-512g-ssd-+-1000g-hhd-narrow-side,1,4.2,2024-04-19,Nwnlap,
193627,"Woman Windows 10 Laptop Office Education Gaming Laptop Pink 15.6"" Intel Celeron J4125 10th Gen 12G RAM 1T Dual WiFi Narrow Side",15368000.0,238,5407,"woman-windows-10-laptop-office-education-gaming-laptop-pink-15.6""-intel-celeron-j4125-10th-gen-12g-ram-1t-dual-wifi-narrow-side",2,4.67,2024-05-20,Carbayta,
265002,Kids Tilting Machine Learning Calculator Educational Toys Toddler Games Educational Math Calculator Math Toys Toddler Games,670000.0,238,6,kids-tilting-machine-learning-calculator-educational-toys-toddler-games-educational-math-calculator-math-toys-toddler-games,1,4.19,2024-08-05,No brand,
195438,Topton L10 Dual Screen Laptop 15.6 Inch IPS + 7 Inch Touch Intel N100 Max 32G DDR4 2T SSD Slim Office Laptop Office Laptop,28306000.0,238,200,topton-l10-dual-screen-laptop-15.6-inch-ips-+-7-inch-touch-intel-n100-max-32g-ddr4-2t-ssd-slim-office-laptop-office-laptop,2,4.29,2024-04-04,One gx,
208581,15.6 inch slim gaming laptop PC laptop Office laptop,21317000.0,238,2000,15.6-inch-slim-gaming-laptop-pc-laptop-office-laptop,2,4.26,2024-01-15,Aotesier,
206161,Windows 10 15.6 inch J4125 Notebook 128GB Education Laptop,15612000.0,238,2000,windows-10-15.6-inch-j4125-notebook-128gb-education-laptop,1,4.43,2024-05-08,Aotesier,
210108,English Learning Tablet Laptop Learning Computer Reading Machine Educational Toys Birthday Gifts For Kids,6529000.0,238,605,english-learning-tablet-laptop-learning-computer-reading-machine-educational-toys-birthday-gifts-for-kids,2,4.0,2024-05-07,No brand,
207948,15.6 Inch Slim Laptop 8+128gb Gaming Laptop Office Laptop Pc Laptop,15612000.0,238,2000,15.6-inch-slim-laptop-8+128gb-gaming-laptop-office-laptop-pc-laptop,1,4.28,2024-11-10,Aotesier,
189295,Wholesale 15.6 inch J3455 education gaming portable slim laptop learning cheap laptop,15612000.0,238,2000,wholesale-15.6-inch-j3455-education-gaming-portable-slim-laptop-learning-cheap-laptop,1,4.15,2024-10-19,Aotesier,
207629,15.6 Inch Slim Laptop 8+128gb Gaming Laptop Office Laptop Pc Laptop,15612000.0,238,2000,15.6-inch-slim-laptop-8+128gb-gaming-laptop-office-laptop-pc-laptop,2,4.33,2024-06-01,Aotesier,
