product_id,product_name,original_price,category_id,stock,slug,vendor_id,ratings,date_add,brand,product_description
173895,Baseus A0Pro Car Vacuum Cleaner Wireless Handheld Mini Car Vacuum Cleaner Wireless Car Vacuum Cleaner for Car PC Cleaning,3022000.0,235,98,baseus-a0pro-car-vacuum-cleaner-wireless-handheld-mini-car-vacuum-cleaner-wireless-car-vacuum-cleaner-for-car-pc-cleaning,1,4.45,2024-07-05,Baseus,
189626,Automatic Car Back Seat Organizer Multi-Pocket Tablet Storage Bag Car Interior Folding Tidying Bag Car Accessories,2228000.0,235,152,automatic-car-back-seat-organizer-multi-pocket-tablet-storage-bag-car-interior-folding-tidying-bag-car-accessories,2,4.23,2024-05-31,No brand,
180804,Multifunctional Car Auto Trunk Towel Holder Car Hook Auto Accessories Internal Storage Organizer Rack,526000.0,235,1961,multifunctional-car-auto-trunk-towel-holder-car-hook-auto-accessories-internal-storage-organizer-rack,1,4.17,2024-07-19,No brand,
216376,1Pcs Portable Car Heater Special Support 180° Rotation 2 In 1 Car Battery Powered Car Heater For Camping Tent,1556000.0,235,999,1pcs-portable-car-heater-special-support-180°-rotation-2-in-1-car-battery-powered-car-heater-for-camping-tent,1,4.23,2024-02-27,No brand,
234173,Cute Car Decoration Helicopter Airplane Accessories For Cars Supplies Novelty Rotating Perfume Diffuser Fragrance,1400000.0,235,8887,cute-car-decoration-helicopter-airplane-accessories-for-cars-supplies-novelty-rotating-perfume-diffuser-fragrance,1,4.22,2024-03-30,No brand,
105724,10/30Pcs Car Tire Rubber Repair Nail Set Multi-Function Car Motorcycle Tire Nails Truck Scooter Bicycle Tire Puncture Repair Tool,985000.0,235,483,10/30pcs-car-tire-rubber-repair-nail-set-multi-function-car-motorcycle-tire-nails-truck-scooter-bicycle-tire-puncture-repair-tool,2,0.0,2024-10-29,No brand,
181510,Multifunctional Car Auto Fixed Bracket Car Trunk Strap Clip Hook Mount Car Interior Accessories,668000.0,235,109,multifunctional-car-auto-fixed-bracket-car-trunk-strap-clip-hook-mount-car-interior-accessories,2,3.88,2024-01-16,No brand,
218254,Motorcycle Accessories Yellow Duck with Helmet for Bicycle without Light Car Decorations Duck Accessories for Car Interior Decoration,526000.0,235,27,motorcycle-accessories-yellow-duck-with-helmet-for-bicycle-without-light-car-decorations-duck-accessories-for-car-interior-decoration,2,4.33,2024-03-27,No brand,
185973,Baby Car Airplane Inflatable Bed Travel Mattress Thick Bed Air Mattress Camping Car Air Mattress Car Interior Accessories,3051000.0,235,999,baby-car-airplane-inflatable-bed-travel-mattress-thick-bed-air-mattress-camping-car-air-mattress-car-interior-accessories,1,4.25,2024-09-22,Dutrieux,
80166,12V Portable Car Electric Oven Food Warmer Mini Personal Hot Lunch Box For Cooking And Warming Meals In Car Truck,1540000.0,235,499,12v-portable-car-electric-oven-food-warmer-mini-personal-hot-lunch-box-for-cooking-and-warming-meals-in-car-truck,2,0.0,2024-06-28,No brand,
238469,Bulldog Car Air Freshener Pilot Car Diffuser Funny Car Perfume Matte BLACK Car Perfume Bulldog Perfume Air Purifier,1419000.0,235,4990,bulldog-car-air-freshener-pilot-car-diffuser-funny-car-perfume-matte-black-car-perfume-bulldog-perfume-air-purifier,1,4.5,2024-11-07,No brand,
245445,Car Wheel Cleaning Brush Long Handle Blue Black Red Car Wheel Rim Hub Cleaning Tire Detail Brush Car Motorcycle Washing Tool Brush,991000.0,235,60,car-wheel-cleaning-brush-long-handle-blue-black-red-car-wheel-rim-hub-cleaning-tire-detail-brush-car-motorcycle-washing-tool-brush,1,4.23,2024-09-01,No brand,
171775,Multi-function Car Mini Umbrella Clip Holder Clip Hook Multi-function Car Trunk Mount Car Interior Accessories,664000.0,235,19,multi-function-car-mini-umbrella-clip-holder-clip-hook-multi-function-car-trunk-mount-car-interior-accessories,2,4.13,2024-03-14,No brand,
238036,Anime Car Interior Stickers Cute Car Window Trim Die-cut Vinyl Sticker Audi BMW Car Decoration Accessories,634000.0,235,74,anime-car-interior-stickers-cute-car-window-trim-die-cut-vinyl-sticker-audi-bmw-car-decoration-accessories,1,3.92,2024-11-07,No brand,
217960,Car Air Freshener Pendant Long Lasting Fragrance Perfume Diffuser Hanging Car Perfume Accessories Ornaments Car Decoration,399000.0,235,61,car-air-freshener-pendant-long-lasting-fragrance-perfume-diffuser-hanging-car-perfume-accessories-ornaments-car-decoration,2,3.0,2024-08-20,No brand,
230725,Shaking Girl's Breasts Car Dashboard Decoration Sexy Cute Plump Doll Shaped Car Interior Accessories Bicycle Motorcycle Decoration 2 Sizes,615000.0,235,14,shaking-girl's-breasts-car-dashboard-decoration-sexy-cute-plump-doll-shaped-car-interior-accessories-bicycle-motorcycle-decoration-2-sizes,2,4.3,2024-01-22,No brand,
168829,New Multifunctional Car Auto Fixed Bracket Car Trunk Strap Clip Hook Mount Car Interior Accessories,671000.0,235,24,new-multifunctional-car-auto-fixed-bracket-car-trunk-strap-clip-hook-mount-car-interior-accessories,2,4.6,2024-05-02,Dawndesslo,
12097,New Multifunctional Car Auto Fixed Bracket Car Trunk Strap Clip Hook Mount Car Interior Accessories,726000.0,235,58857,new-multifunctional-car-auto-fixed-bracket-car-trunk-strap-clip-hook-mount-car-interior-accessories,2,3.84,2024-10-12,No brand,
195191,PU Leather Car Trunk Storage Box Luxury Car Organizer Folding Car Storage Bag Folding Tidying Box For Sedan SUV MPV,5471000.0,235,316,pu-leather-car-trunk-storage-box-luxury-car-organizer-folding-car-storage-bag-folding-tidying-box-for-sedan-suv-mpv,2,4.29,2024-03-17,Taoleqi,
256945,Electric Motor Remote Control Car Kit Battery Box Switch With LED Power Function Wood Building Blocks Car Motorcycle Toys,865000.0,235,14,electric-motor-remote-control-car-kit-battery-box-switch-with-led-power-function-wood-building-blocks-car-motorcycle-toys,1,4.4,2024-11-07,No brand,
218444,Metal Car Temporary Parking Tag Rotating Phone Number Plate Aluminum Stop Sticker Car Styling Car Accessories Decoration,2001000.0,235,6,metal-car-temporary-parking-tag-rotating-phone-number-plate-aluminum-stop-sticker-car-styling-car-accessories-decoration,1,4.0,2024-01-24,No brand,
263924,Mecanum Wheel Car Chassis With TT Motor Aluminum Alloy Frame Smart Car DIY Kit Educational Robot Car Hiwonder,5328000.0,235,72,mecanum-wheel-car-chassis-with-tt-motor-aluminum-alloy-frame-smart-car-diy-kit-educational-robot-car-hiwonder,1,4.39,2024-01-25,No brand,
192512,Cargo Storage Tool Car Trunk Organizer Eco-Friendly Stacking Tidying Car Storage Box For Car Truck SUV Trunk Box,659000.0,235,66,cargo-storage-tool-car-trunk-organizer-eco-friendly-stacking-tidying-car-storage-box-for-car-truck-suv-trunk-box,1,4.39,2024-09-27,No brand,
230699,Latest Game GTA 1psc Car Pendant Car Air Freshener JDM Racing Style Pendant,664000.0,235,9,latest-game-gta-1psc-car-pendant-car-air-freshener-jdm-racing-style-pendant,1,4.83,2024-05-19,Jinhf,
199437,Automatic Car Back Seat Organizer Multi-Pocket Tablet Storage Bag Car Interior Accessories Stowing Tidying Bag,2302000.0,235,155,automatic-car-back-seat-organizer-multi-pocket-tablet-storage-bag-car-interior-accessories-stowing-tidying-bag,1,4.18,2024-04-21,No brand,
190896,Car Multifunctional Seat Back Organizer Multi Pockets Tablet Storage Bag Car Interior Accessories Stowing Tidying,1003000.0,235,200,car-multifunctional-seat-back-organizer-multi-pockets-tablet-storage-bag-car-interior-accessories-stowing-tidying,1,4.38,2024-02-24,No brand,
189661,Automatic Car Back Seat Organizer Multi-Pocket Tablet Storage Bag Car Interior Accessories Stowing Tidying Bag,1271000.0,235,48,automatic-car-back-seat-organizer-multi-pocket-tablet-storage-bag-car-interior-accessories-stowing-tidying-bag,1,4.45,2024-10-25,No brand,
180473,Car Audio Car Repair Tools Rivet Clips Wire Door Panel Trim Car Interior Removal Tools Car Disassembly Tools Pry Removal Tool,16986000.0,235,58,car-audio-car-repair-tools-rivet-clips-wire-door-panel-trim-car-interior-removal-tools-car-disassembly-tools-pry-removal-tool,1,4.0,2024-10-04,Xmsj,
179416,Car Audio Car Repair Tools Rivet Clips Wire Door Panel Trim Car Interior Removal Tools Car Disassembly Tools Pry Removal Tool,2264000.0,235,12,car-audio-car-repair-tools-rivet-clips-wire-door-panel-trim-car-interior-removal-tools-car-disassembly-tools-pry-removal-tool,1,5.0,2024-08-20,Joigvfn,
182327,Car Bed Mattress | Inflatable Car Mattress for Car Trunk | Car Mattress Car Camping Mattress Inflatable Travel Bed,1326000.0,235,11,car-bed-mattress-|-inflatable-car-mattress-for-car-trunk-|-car-mattress-car-camping-mattress-inflatable-travel-bed,2,4.35,2024-04-25,No brand,
105900,10/20/30/40/50Pcs 8mm Auto Car Fasteners For Car Clips Car Products Plastic Clips Rivets For GM Ford Chrysler Cars,645000.0,235,50,10/20/30/40/50pcs-8mm-auto-car-fasteners-for-car-clips-car-products-plastic-clips-rivets-for-gm-ford-chrysler-cars,1,4.88,2024-07-14,Zmfjh,
214076,Stowing Tidying PU Leather Car Storage Bag Car Mesh Bag Car Back Seat Pocket Car Organizer Box Wallet Car Accessories,671000.0,235,10,stowing-tidying-pu-leather-car-storage-bag-car-mesh-bag-car-back-seat-pocket-car-organizer-box-wallet-car-accessories,1,4.2,2024-01-22,Wymect,
170072,Universal Car Auto Visor Clip Organizer Car Parking Card Holder Car-Styling Temporary Parking Phone Number IC High Speed ​​Card Clip,668000.0,235,9,universal-car-auto-visor-clip-organizer-car-parking-card-holder-car-styling-temporary-parking-phone-number-ic-high-speed-​​card-clip,1,4.5,2024-04-17,Wymect,
229774,Cute Duck Car Auto Motorcycle Mtb Bicycle Interior Accessories Helmet Small Yellow Duck Auto For Tesla BMW VW Benz Decoration Parts,367000.0,235,856,cute-duck-car-auto-motorcycle-mtb-bicycle-interior-accessories-helmet-small-yellow-duck-auto-for-tesla-bmw-vw-benz-decoration-parts,1,2.2,2024-11-04,No brand,
205583,Multifunctional Car Vehicle Storage Net Car Storage Bag Stowing Tidying Car Phone Holder Pocket Box Accessories,526000.0,235,56,multifunctional-car-vehicle-storage-net-car-storage-bag-stowing-tidying-car-phone-holder-pocket-box-accessories,1,3.75,2024-04-11,No brand,
158734,NEW Original 9500000Pa 5 in1 Wireless Vacuum Cleaner Car Portable Handheld Robot Vacuum Cleaner For Car Home Appliances,1874000.0,235,318,new-original-9500000pa-5-in1-wireless-vacuum-cleaner-car-portable-handheld-robot-vacuum-cleaner-for-car-home-appliances,2,4.27,2024-08-14,No brand,
11426,Cute Cartoon Pig Car Decoration Creative Women Car Center Console Interior Car Dashboard Decoration Car Accessories,526000.0,235,17,cute-cartoon-pig-car-decoration-creative-women-car-center-console-interior-car-dashboard-decoration-car-accessories,1,4.75,2024-10-15,No brand,
219033,Cute Pig Car Ornament Air Purifier Air Conditioner Outlet Decoration Car Accessories Car Air Freshener Perfume Clip,671000.0,235,19,cute-pig-car-ornament-air-purifier-air-conditioner-outlet-decoration-car-accessories-car-air-freshener-perfume-clip,2,5.0,2024-03-08,No brand,
192962,KAWOSEN Car Trunk Storage Bag PU Leather Box Foldable Storage Bag Car Trunk Stowing Tidying Multi-Function Car Trunk HDTO06,3949000.0,235,20,kawosen-car-trunk-storage-bag-pu-leather-box-foldable-storage-bag-car-trunk-stowing-tidying-multi-function-car-trunk-hdto06,1,4.32,2024-02-01,Kawosen,
239956,Car Motorcycle Heater Windshield Heating Dynamic Heater For Car Mini Portable Molecular Dynamic Auto Winter Accessories,526000.0,235,16,car-motorcycle-heater-windshield-heating-dynamic-heater-for-car-mini-portable-molecular-dynamic-auto-winter-accessories,2,1.0,2024-07-03,No brand,
225911,Sea Turtle Hanging Ornament Car Decoration Car Ornaments Car Interior Decoration Accessories Dropshipping,654000.0,235,514,sea-turtle-hanging-ornament-car-decoration-car-ornaments-car-interior-decoration-accessories-dropshipping,2,2.0,2024-02-10,No brand,
12170,Car Hanging Trash Can Trash Car Dust Storage Box ABS Square Pressed Trash Can Car Interior Accessories For Cars,830000.0,235,10613,car-hanging-trash-can-trash-car-dust-storage-box-abs-square-pressed-trash-can-car-interior-accessories-for-cars,1,4.02,2024-01-23,Dutrieux,
282967,Baby Bear Car Safety Belt Shoulder Protector Stroller Strap Cover Stroller Car Accessories Baby Car Accessories,526000.0,235,8,baby-bear-car-safety-belt-shoulder-protector-stroller-strap-cover-stroller-car-accessories-baby-car-accessories,1,4.4,2024-02-27,Oimg,
202697,Elastic Seat Net Bag Car Back Seat Net Trunk Car Rear Storage Net Car Rear Trunk Net Organizer For Car Storage,891000.0,235,51,elastic-seat-net-bag-car-back-seat-net-trunk-car-rear-storage-net-car-rear-trunk-net-organizer-for-car-storage,2,4.27,2024-02-20,No brand,
190282,Car Trunk Car Organizer Bag Anti-Slip Organizer Box Car Trunk Multi-Function Storage Bag Tidying Car Interior Tools Accessories,1377000.0,235,0,car-trunk-car-organizer-bag-anti-slip-organizer-box-car-trunk-multi-function-storage-bag-tidying-car-interior-tools-accessories,2,5.0,2024-05-03,No brand,
238398,High Quality Car DIY Perfume Pendant Hanging Diffuser Car Rearview Mirror Hanging Air Freshener For Car Interior Decoration,2465000.0,235,9986,high-quality-car-diy-perfume-pendant-hanging-diffuser-car-rearview-mirror-hanging-air-freshener-for-car-interior-decoration,2,5.0,2024-05-31,No brand,
200723,Car Sun Visor Organizer Card Holder Slot Plate Holder With Car Parking Organizer Storage Car-Styling Folding Tidying,526000.0,235,499,car-sun-visor-organizer-card-holder-slot-plate-holder-with-car-parking-organizer-storage-car-styling-folding-tidying,1,4.95,2024-09-30,Autoecho,
190855,PU Leather Car Trunk Storage Box Luxury Car Organizer Folding Car Storage Bag Folding Tidying Box For Sedan SUV MPV,1522000.0,235,9,pu-leather-car-trunk-storage-box-luxury-car-organizer-folding-car-storage-bag-folding-tidying-box-for-sedan-suv-mpv,1,4.25,2024-10-26,Taoleqi,
9844,Car Moulding Decorative Flexible Strips1/3/5M Car Interior Mouldings Automotive Trim Door Panel Edgein Car-Styling Multi-purpose,526000.0,235,44,car-moulding-decorative-flexible-strips1/3/5m-car-interior-mouldings-automotive-trim-door-panel-edgein-car-styling-multi-purpose,1,4.83,2024-07-06,No brand,
198103,Cartoon Car Back Seat Storage Hanging Bag Car Styling Baby Products Varia Stowing Tidying Car Interior Accessories,1340000.0,235,4996,cartoon-car-back-seat-storage-hanging-bag-car-styling-baby-products-varia-stowing-tidying-car-interior-accessories,1,3.97,2024-07-26,Stylish wiz,
181015,30Pcs Car Roof Rain Gutter Molding Trim Strip Clip For BMW E46 51138204858 Car Roof Buckle Clip Car Accessories,706000.0,235,998,30pcs-car-roof-rain-gutter-molding-trim-strip-clip-for-bmw-e46-51138204858-car-roof-buckle-clip-car-accessories,2,5.0,2024-10-25,Nightkist,
211816,Cartoon Car Seat Back Storage Hanging Bag Car Organizer-Baby Styling Product Stowing Tidying Cartoon Car Seat Organizer,2836000.0,235,798,cartoon-car-seat-back-storage-hanging-bag-car-organizer-baby-styling-product-stowing-tidying-cartoon-car-seat-organizer,1,4.36,2024-09-13,No brand,
204083,Car Trunk Organizer Large Capacity Cargo Storage Bag Oxford Fabric Multi-Pocket Car Trunk Organizer Car Interior Stowing Tidying,1742000.0,235,6,car-trunk-organizer-large-capacity-cargo-storage-bag-oxford-fabric-multi-pocket-car-trunk-organizer-car-interior-stowing-tidying,2,4.23,2024-01-16,Apwikoger,
10626,Cute cartoon pig car decoration female creative car center console car interior decoration car hanging accessories,632000.0,235,7,cute-cartoon-pig-car-decoration-female-creative-car-center-console-car-interior-decoration-car-hanging-accessories,1,4.12,2024-08-19,No brand,
203675,Multi Pockets Car Trunk Storage Bag Portable Organizer Car Trunk Felt Organizer Car Interior Stowing Cleaning,1017000.0,235,14,multi-pockets-car-trunk-storage-bag-portable-organizer-car-trunk-felt-organizer-car-interior-stowing-cleaning,1,4.17,2024-08-26,Alloyseed,
232102,New Creative Concealer Car Seat Back Multi-Function Hook Rear Car Phone Holder Hook Car Accessories,447000.0,235,50,new-creative-concealer-car-seat-back-multi-function-hook-rear-car-phone-holder-hook-car-accessories,2,5.0,2024-07-01,No brand,
118544,Car Audio Car Repair Tools Rivet Clips Wire Door Panel Trim Car Interior Removal Tools Car Disassembly Tools Pry Removal Tool,1029000.0,235,3,car-audio-car-repair-tools-rivet-clips-wire-door-panel-trim-car-interior-removal-tools-car-disassembly-tools-pry-removal-tool,2,5.0,2024-05-04,No brand,
181813,Car Trunk Holder Multi-function Car Clip Rope Holder Car Mount Hook Umbrella Stand Organize Storage Keep,551000.0,235,5000,car-trunk-holder-multi-function-car-clip-rope-holder-car-mount-hook-umbrella-stand-organize-storage-keep,1,5.0,2024-01-24,No brand,
213766,Car Seat Organizer Car Door Storage Box Car Seat Side Storage Bag Car Crevice Organizer Interior Part Car Accessories,922000.0,235,499,car-seat-organizer-car-door-storage-box-car-seat-side-storage-bag-car-crevice-organizer-interior-part-car-accessories,2,4.16,2024-04-03,No brand,
168422,Car Seat Belt Clips Car Interior Extensions Seat Belt Clips Metal Extenders Car Decoration Accessories For Mercedes Benz,6126000.0,235,976,car-seat-belt-clips-car-interior-extensions-seat-belt-clips-metal-extenders-car-decoration-accessories-for-mercedes-benz,1,2.0,2024-02-17,No brand,
222389,Cute Pig Bicycle Motorcycle Car Decoration Little Pig Pendant With Helmet Airscrew Car Interior Decoration Accessories Birthday Gift,694000.0,235,19,cute-pig-bicycle-motorcycle-car-decoration-little-pig-pendant-with-helmet-airscrew-car-interior-decoration-accessories-birthday-gift,2,4.8,2024-04-29,No brand,
246330,Soft Hair Car Air Conditioning Cleaning Brush Car Detailing Air Outlet Vent Brush Vacuum Cleaner for Car Wash Parts,782000.0,235,65,soft-hair-car-air-conditioning-cleaning-brush-car-detailing-air-outlet-vent-brush-vacuum-cleaner-for-car-wash-parts,1,4.78,2024-08-15,Seametal,
173077,1900000PA Handheld Wireless Car Vacuum Cleaner Mini Handheld Vacuum Cleaner Strong Suction Car Cleaner,2230000.0,235,53,1900000pa-handheld-wireless-car-vacuum-cleaner-mini-handheld-vacuum-cleaner-strong-suction-car-cleaner,2,4.73,2024-02-09,Xmsj,
238274,5mm/10mm Car Perfume Diffuser Air Purifier Natural Plant Essential Oil Car Outlet Vent Fragrance Fragrance Humidifier Cooler,1369000.0,235,983,5mm/10mm-car-perfume-diffuser-air-purifier-natural-plant-essential-oil-car-outlet-vent-fragrance-fragrance-humidifier-cooler,2,3.67,2024-08-02,No brand,
191749,Folding Car Trunk Storage Bag Auto Organizer 36L/ 72L/ 110L Large Capacity Car Trunk Folding Tidying Car Interior Storage Box,1644000.0,235,499,folding-car-trunk-storage-bag-auto-organizer-36l/-72l/-110l-large-capacity-car-trunk-folding-tidying-car-interior-storage-box,2,4.0,2024-05-11,No brand,
224693,Practical Car Pendant Interior Decoration Hanging Halloween Christmas Bear Car Hanging Toy Gift Car Decoration Accessories,1630000.0,235,6,practical-car-pendant-interior-decoration-hanging-halloween-christmas-bear-car-hanging-toy-gift-car-decoration-accessories,1,3.25,2024-05-12,Coindesk,
227785,Cute Cartoon Pig Car Decoration Creative Women Car Center Console Car Interior Decoration Car Hanging Decorative Accessories,1081000.0,235,591,cute-cartoon-pig-car-decoration-creative-women-car-center-console-car-interior-decoration-car-hanging-decorative-accessories,2,4.6,2024-06-08,No brand,
235838,Solar Car Air Purifier Helicopter Propeller Car Perfume Men Auto Interior Accessories Woman Car Perfume Decoration,626000.0,235,1000,solar-car-air-purifier-helicopter-propeller-car-perfume-men-auto-interior-accessories-woman-car-perfume-decoration,1,3.7,2024-02-29,No brand,
177976,Car Audio Car Repair Tools Rivet Clips Wire Door Panel Trim Car Interior Removal Tools Car Disassembly Tools Pry Removal Tool,2004000.0,235,20,car-audio-car-repair-tools-rivet-clips-wire-door-panel-trim-car-interior-removal-tools-car-disassembly-tools-pry-removal-tool,2,4.5,2024-10-07,Larath,
222598,Luxury Crystal Car Rearview Mirror Pendant Decoration Bling Car Mirror Hanging Car Interior Decoration Accessories,1630000.0,235,10,luxury-crystal-car-rearview-mirror-pendant-decoration-bling-car-mirror-hanging-car-interior-decoration-accessories,2,4.83,2024-06-07,No brand,
173607,1/2Pcs/Pack Car Trunk Umbrella Hook Hanger Hook Car Interior Multi-Function Car Accessories Storage Rack,1630000.0,235,28,1/2pcs/pack-car-trunk-umbrella-hook-hanger-hook-car-interior-multi-function-car-accessories-storage-rack,1,4.67,2024-05-01,No brand,
232076,Small Cute Charcoal Ball Car Seat Back Storage Hook Car Headrest Organizer Food Bag Handbag Car Decoration Clothes Hanger,617000.0,235,13,small-cute-charcoal-ball-car-seat-back-storage-hook-car-headrest-organizer-food-bag-handbag-car-decoration-clothes-hanger,1,4.36,2024-11-06,No brand,
174801,Card Clip Lanyard Clip Car Sun Visor Sunglasses Holder Portable Eyeglasses Clip Car-styling Car Glasses Case Multi-Functional,1630000.0,235,50,card-clip-lanyard-clip-car-sun-visor-sunglasses-holder-portable-eyeglasses-clip-car-styling-car-glasses-case-multi-functional,1,3.0,2024-03-13,No brand,
183139,Car Parking Ticket Holder Car Parking Ticket Holder Windshield Mounted Card Holder Storage For Car Dashboard Door Organizer,692000.0,235,8,car-parking-ticket-holder-car-parking-ticket-holder-windshield-mounted-card-holder-storage-for-car-dashboard-door-organizer,2,3.71,2024-05-03,Rpxbguckarhg,
179450,100Pcs Mixed Metal Screws Fastener Clips M5 Self-Removing Screws Vehicle Retainer Clips Screws For Car Motorcycle ATV Motorbike E-Bike,1272000.0,235,9000,100pcs-mixed-metal-screws-fastener-clips-m5-self-removing-screws-vehicle-retainer-clips-screws-for-car-motorcycle-atv-motorbike-e-bike,1,5.0,2024-04-28,Noenname_null,
170001,25Pcs Car Wheel Arch Liner Wire Washer Plastic Fixing Clip 4F0825429A For Audi A4 B8,585000.0,235,9717,25pcs-car-wheel-arch-liner-wire-washer-plastic-fixing-clip-4f0825429a-for-audi-a4-b8,2,5.0,2024-05-21,Cw&gq,
206135,Car Trunk Fashion Storage Box Straw Car Interior Basket Car Road Trip Supplies Storage Box Lockable,3113000.0,235,50,car-trunk-fashion-storage-box-straw-car-interior-basket-car-road-trip-supplies-storage-box-lockable,2,4.37,2024-10-27,Gisaev,
188215,Set of 5 High Quality Car Wire Ties Fixer Organizer Cable Clips Line Holder Computer USB Cord Wire Car Interior,473000.0,235,7,set-of-5-high-quality-car-wire-ties-fixer-organizer-cable-clips-line-holder-computer-usb-cord-wire-car-interior,1,5.0,2024-02-09,Dedomon,
195598,Folding Car Trunk Storage Bag 1680D Oxford Fabric Folding Tidying Bag Storage Box Car Decoration Container,1943000.0,235,1198,folding-car-trunk-storage-bag-1680d-oxford-fabric-folding-tidying-bag-storage-box-car-decoration-container,2,4.1,2024-10-07,Oimg,
187294,3Pcs/Set Multi-purpose Plastic Car Hanger Sticky Clips For Car Home Wall Keys Clothes Rack,799000.0,235,44999,3pcs/set-multi-purpose-plastic-car-hanger-sticky-clips-for-car-home-wall-keys-clothes-rack,1,4.71,2024-03-26,Aqtqaq,
193869,Folding Car Trunk Storage Bag Non-Woven Stowing Tidying Bag Storage Box Car Decoration Box,1348000.0,235,36,folding-car-trunk-storage-bag-non-woven-stowing-tidying-bag-storage-box-car-decoration-box,2,5.0,2024-03-11,No brand,
186074,Self Tapping Screw M5 Car Motorcycle Metal Screw Wire Clip Auto Electrocar Scooter E-bike Motorcycle Anti Rust Screws,697000.0,235,59,self-tapping-screw-m5-car-motorcycle-metal-screw-wire-clip-auto-electrocar-scooter-e-bike-motorcycle-anti-rust-screws,2,5.0,2024-08-04,No brand,
235202,Car Accessories Perfume Helicopter Solar Car Decoration Gift Perfume Car Perfume Decorative Airplane,3331000.0,235,1440,car-accessories-perfume-helicopter-solar-car-decoration-gift-perfume-car-perfume-decorative-airplane,2,4.05,2024-07-29,Tefanball,
174335,Car Vacuum Cleaner Wireless Automatic Vacuum Cleaner Robot Cordless Cleaner Car Home Appliances Powerful Vacuum Cleaner,2439000.0,235,20,car-vacuum-cleaner-wireless-automatic-vacuum-cleaner-robot-cordless-cleaner-car-home-appliances-powerful-vacuum-cleaner,1,4.41,2024-06-22,Suitu,
221723,Motorcycle Skull Car Pendant Mirror Decoration Hanging Car Rearview Mirror Pendant Hanging Halloween Christmas Flat Decoration,463000.0,235,995,motorcycle-skull-car-pendant-mirror-decoration-hanging-car-rearview-mirror-pendant-hanging-halloween-christmas-flat-decoration,1,3.0,2024-09-14,No brand,
180346,10/20Pcs Car Door Strip Liner Metal Fastener Clips For Volkswagen Car Seat Trunk Tailgate Retainer Clips,565000.0,235,31,10/20pcs-car-door-strip-liner-metal-fastener-clips-for-volkswagen-car-seat-trunk-tailgate-retainer-clips,2,4.8,2024-09-12,No brand,
225237,6/1Pcs Cartoon Car Sleeping Figure Ornament Computer Screen Decoration Auto Center Console Ornaments Cute Car Decoration Accessories,671000.0,235,52425,6/1pcs-cartoon-car-sleeping-figure-ornament-computer-screen-decoration-auto-center-console-ornaments-cute-car-decoration-accessories,2,4.14,2024-04-14,No brand,
9707,10Pcs 20cm Car Air Conditioning Vent Outlet Trim Strip U Shape Chrome PVC Colorful Shiny Car Trim Strip Car Decoration,732000.0,235,148,10pcs-20cm-car-air-conditioning-vent-outlet-trim-strip-u-shape-chrome-pvc-colorful-shiny-car-trim-strip-car-decoration,1,4.85,2024-08-16,Celanova,
205136,Car Trunk Organizer With 4 Cargo Storage Pockets Oxford Cloth Bag Multi-Pocket Car Trunk Organizer Car Interior Organizer Neatly,1780000.0,235,5,car-trunk-organizer-with-4-cargo-storage-pockets-oxford-cloth-bag-multi-pocket-car-trunk-organizer-car-interior-organizer-neatly,1,4.31,2024-08-19,Vodool,
81621,8L Baby Food Warmer Digital Portable Milk Bottle Warmer Oven Car 12V Car Food Warmer Heats Lunch Box with Preset Temperature,1605000.0,235,0,8l-baby-food-warmer-digital-portable-milk-bottle-warmer-oven-car-12v-car-food-warmer-heats-lunch-box-with-preset-temperature,1,0.0,2024-01-12,No brand,
173951,Multi-Function Car Seat Back Headrest Hook 3 In 1 Car Phone Holder Cup Holder Storage Hanging Clip Car Seatback Travel Accessories,682000.0,235,50,multi-function-car-seat-back-headrest-hook-3-in-1-car-phone-holder-cup-holder-storage-hanging-clip-car-seatback-travel-accessories,1,3.85,2024-11-09,No brand,
