product_id,product_name,original_price,category_id,stock,slug,vendor_id,ratings,date_add,brand,product_description
181353,Artificial Garden Fence Wooden House Privacy Fence Simple Installation For Balcony Yard Window Shop Study Decoration,803000.0,249,499,artificial-garden-fence-wooden-house-privacy-fence-simple-installation-for-balcony-yard-window-shop-study-decoration,2,3.5,2024-03-11,No brand,
277326,Cute Dog Shape Imitation Stained Glass Door Hook Window Hanging Pendant Suncatcher For Home Garden Decor Living Room Office Ornament,526000.0,249,987,cute-dog-shape-imitation-stained-glass-door-hook-window-hanging-pendant-suncatcher-for-home-garden-decor-living-room-office-ornament,1,4.0,2024-08-27,No brand,
193266,Moden Waterproof Outdoor Wall Light PIR Motion Sensor Garden Lamp Porch Front Door Black Aluminum Body Indoor Walllight,11015000.0,249,200,moden-waterproof-outdoor-wall-light-pir-motion-sensor-garden-lamp-porch-front-door-black-aluminum-body-indoor-walllight,1,4.14,2024-03-25,Noenname_null,
174133,6Pcs Durable Garden Gnome Wooden Door Eco-Friendly Colorful Fairy Dollhouse Decoration Fairy Tale Door Craft Accessories,705000.0,249,1,6pcs-durable-garden-gnome-wooden-door-eco-friendly-colorful-fairy-dollhouse-decoration-fairy-tale-door-craft-accessories,1,1.0,2024-06-20,No brand,
243083,Garden Watering Filter 1/2 Kitchen Water Filter Car Wash Irrigation Prefilter Aquarium Water Pump Water Filter Air Inlet,1474000.0,249,9990,garden-watering-filter-1/2-kitchen-water-filter-car-wash-irrigation-prefilter-aquarium-water-pump-water-filter-air-inlet,2,5.0,2024-03-02,Sgoohan,
213842,Wild Bird Window Feeder Transparent Plastic Bird Feeder Hanging Peanuts Seed Feeder Garden Station Seed Container,1607000.0,249,128,wild-bird-window-feeder-transparent-plastic-bird-feeder-hanging-peanuts-seed-feeder-garden-station-seed-container,2,4.5,2024-06-14,No brand,
222353,Vintage Watering Can Gold Hot Pot Garden Metal Iron Water Bucket For Watering Plants Flowers Home Decor Dropshipping,595000.0,249,875,vintage-watering-can-gold-hot-pot-garden-metal-iron-water-bucket-for-watering-plants-flowers-home-decor-dropshipping,1,4.22,2024-03-08,No brand,
224499,1/4 Metal Bird Wall Art Sculpture Outdoor Hanging Decoration For Garden/Home Decor,654000.0,249,34,1/4-metal-bird-wall-art-sculpture-outdoor-hanging-decoration-for-garden/home-decor,2,3.62,2024-09-09,No brand,
381686,Large Laden Filing Cabinet Vanity Wood Outdoor Garden Screen Patio Glass Side Cabinet Door Kitchen Armarios Home Furniture,52444000.0,249,70,large-laden-filing-cabinet-vanity-wood-outdoor-garden-screen-patio-glass-side-cabinet-door-kitchen-armarios-home-furniture,2,4.11,2024-04-17,Oein,
139220,Aquarium Decoration Cute Animal Accessories Bookshelf Collective Decort Home Garden Decoration Miniature Resin Craft,526000.0,249,17,aquarium-decoration-cute-animal-accessories-bookshelf-collective-decort-home-garden-decoration-miniature-resin-craft,1,4.25,2024-07-23,Whphous,
221117,12/24 Artificial Fake Mini Animals Frogs Garden Decorations Lifelike Fake Frogs Bonsai Home Decor,668000.0,249,0,12/24-artificial-fake-mini-animals-frogs-garden-decorations-lifelike-fake-frogs-bonsai-home-decor,1,4.67,2024-04-21,No brand,
212056,Wild Bird Window Feeder House Transparent Wild Removable Table Suction Slide Food Tray For Garden Yard Yard,1122000.0,249,188,wild-bird-window-feeder-house-transparent-wild-removable-table-suction-slide-food-tray-for-garden-yard-yard,2,4.58,2024-01-18,No brand,
227987,10Pcs/Set Luminous Mini Animals Plants Micro Landscape Outdoor Ornaments Glowing Miniature Statues Pots Garden Home Decor,526000.0,249,6,10pcs/set-luminous-mini-animals-plants-micro-landscape-outdoor-ornaments-glowing-miniature-statues-pots-garden-home-decor,2,5.0,2024-07-11,No brand,
224305,Mini Couple Figures Grandpa Grandma Sweety Ex-Lover Fairy Garden Ornaments Miniature Figurines Home Decor,638000.0,249,497,mini-couple-figures-grandpa-grandma-sweety-ex-lover-fairy-garden-ornaments-miniature-figurines-home-decor,1,5.0,2024-04-05,No brand,
224537,Iron Art Metal Decorative Wall Hanging Home Decor Crafts Outdoor Garden Ornaments Living Room Decoration,712000.0,249,30,iron-art-metal-decorative-wall-hanging-home-decor-crafts-outdoor-garden-ornaments-living-room-decoration,2,5.0,2024-08-30,No brand,
224063,10Pcs/Set Luminous Mini Animals Plants Micro Landscape Outdoor Ornaments Glowing Miniature Statues Pots Garden Home Decor,689000.0,249,8,10pcs/set-luminous-mini-animals-plants-micro-landscape-outdoor-ornaments-glowing-miniature-statues-pots-garden-home-decor,1,4.5,2024-01-22,No brand,
209460,Transparent Window House Wild Bird Outdoor Feeder Removable Automatic Sliding Suction Bird Feeder Tray For Garden Yard Yard,1072000.0,249,135,transparent-window-house-wild-bird-outdoor-feeder-removable-automatic-sliding-suction-bird-feeder-tray-for-garden-yard-yard,2,4.8,2024-07-16,No brand,
222792,Hot Watering Can For Indoor Plants Outdoor Flower Watering Can For Indoor Plants Flower Garden Long Hose Indoor Gardening Tools,526000.0,249,227,hot-watering-can-for-indoor-plants-outdoor-flower-watering-can-for-indoor-plants-flower-garden-long-hose-indoor-gardening-tools,1,5.0,2024-03-10,No brand,
218776,6Pcs Cute Frog Animal Miniature Fairy Garden Ornament DIY Glass Ornament Small Object Figurine Model Craft Home Decor,617000.0,249,23,6pcs-cute-frog-animal-miniature-fairy-garden-ornament-diy-glass-ornament-small-object-figurine-model-craft-home-decor,2,4.22,2024-06-02,No brand,
175361,Garden Lighted Sculpture Indoor Outdoor Waterfall Courtyard Garden Decoration Figurine Decorative Fountain,2169000.0,249,2,garden-lighted-sculpture-indoor-outdoor-waterfall-courtyard-garden-decoration-figurine-decorative-fountain,2,2.0,2024-07-23,Apwikoger,
224730,Mini Couple Figures Grandma Grandpa Sweety Lover Old Couple Fairy Garden Ornament Miniature Figurines Home Decor,812000.0,249,6,mini-couple-figures-grandma-grandpa-sweety-lover-old-couple-fairy-garden-ornament-miniature-figurines-home-decor,2,4.71,2024-06-09,No brand,
160125,Solar Bird Bath Fountain Pump Solar Powered Swimming Pool Fountain Colorful Floating Fountain Home Decoration For Garden,1827000.0,249,880,solar-bird-bath-fountain-pump-solar-powered-swimming-pool-fountain-colorful-floating-fountain-home-decoration-for-garden,2,4.01,2024-01-19,Letiittgoo,
221228,Long Spout Watering Can Plant Watering Bottle Home Garden Flower Gardening Tools Pots Water Pot Metal Indoor Watering Can,2245000.0,249,987,long-spout-watering-can-plant-watering-bottle-home-garden-flower-gardening-tools-pots-water-pot-metal-indoor-watering-can,1,4.0,2024-01-09,No brand,
222245,1/2/3Pcs Large Plastic Garden Long Sprinkler Can Water Indoor Outdoor Gardening Home Plant Bonsai Watering Pot,1911000.0,249,945,1/2/3pcs-large-plastic-garden-long-sprinkler-can-water-indoor-outdoor-gardening-home-plant-bonsai-watering-pot,1,4.33,2024-09-21,Liplasting,
220056,Large Plastic Garden Long Sprinkler Watering Can Indoor Outdoor Gardening Home Plants Bonsai Watering Pot Kettle Bottle,1630000.0,249,1000,large-plastic-garden-long-sprinkler-watering-can-indoor-outdoor-gardening-home-plants-bonsai-watering-pot-kettle-bottle,2,3.0,2024-02-03,Liplasting,
222603,Plastic Watering Can Pot Gardening Supplies Garden Plants Adjustable Pressure Water Spray Kettle Indoor 1L Flower Sprayer Home,526000.0,249,15,plastic-watering-can-pot-gardening-supplies-garden-plants-adjustable-pressure-water-spray-kettle-indoor-1l-flower-sprayer-home,1,0.0,2024-02-02,No brand,
181384,Expanding Wooden Garden Wall Fence Panel Climbing Plants Trellis Garden Fence Decoration for Home Yard Garden Decoration,3365000.0,249,50,expanding-wooden-garden-wall-fence-panel-climbing-plants-trellis-garden-fence-decoration-for-home-yard-garden-decoration,1,4.25,2024-01-30,No brand,
224244,Elephant Shape Watering Can Pot Home Garden Flower Plants Tools Succulents Potted Gardening Water,800000.0,249,500,elephant-shape-watering-can-pot-home-garden-flower-plants-tools-succulents-potted-gardening-water,2,4.29,2024-01-13,No brand,
221136,Miniature Fairy Garden Accessories Cute Kawaii Lover Ornament Statue Figurines Home Garden Landscape Dollhouse Terrarium Decoration,735000.0,249,9990,miniature-fairy-garden-accessories-cute-kawaii-lover-ornament-statue-figurines-home-garden-landscape-dollhouse-terrarium-decoration,2,4.67,2024-07-23,No brand,
224860,Watering Can Vintage Brass Watering Can for Watering Plants Lid for Can Water Spray Gardening Spray Home and Garden,1357000.0,249,299,watering-can-vintage-brass-watering-can-for-watering-plants-lid-for-can-water-spray-gardening-spray-home-and-garden,2,4.07,2024-01-21,No brand,
673370,"3-door buffet cabinet, Kitchen storage cabinet with acrylic mirror door, Dusty grey oak",12085000.0,249,29,"3-door-buffet-cabinet,-kitchen-storage-cabinet-with-acrylic-mirror-door,-dusty-grey-oak",2,0.0,2024-02-29,Tulx,
100162,Glawry Boho 72 Waterproof Fabric Shower Curtain Bathroom Curtains Mildew Luxury Home With Hooks Accessories,973000.0,249,102,glawry-boho-72-waterproof-fabric-shower-curtain-bathroom-curtains-mildew-luxury-home-with-hooks-accessories,2,0.0,2024-09-23,No brand,
241488,5Pcs Iron Gardening Cans Watering Pots Kids Watering Kettle For Greenhouse Home,1457000.0,249,7,5pcs-iron-gardening-cans-watering-pots-kids-watering-kettle-for-greenhouse-home,2,4.27,2024-01-29,No brand,
271958,Garden Watering Timer Ball Valve/Solenoid Valve Home Garden Watering Controller Automatic Watering Electronic Valve,1457000.0,249,67,garden-watering-timer-ball-valve/solenoid-valve-home-garden-watering-controller-automatic-watering-electronic-valve,2,3.94,2024-06-06,Aqualin,
32202,New Wireless Welcome Doorbell Smart Home Doorbell Touch Night Light 150M Remote USB Power Waterproof For Home Office,2471000.0,249,503,new-wireless-welcome-doorbell-smart-home-doorbell-touch-night-light-150m-remote-usb-power-waterproof-for-home-office,2,5.0,2024-10-30,No brand,
175232,1 PC 5Pcs Zinc Alloy Metal Window Plates Embossed Characters For Garden Door Sign Mailbox Decoration With Black Coating Nail Kit,1211000.0,249,1,1-pc-5pcs-zinc-alloy-metal-window-plates-embossed-characters-for-garden-door-sign-mailbox-decoration-with-black-coating-nail-kit,1,5.0,2024-10-06,No brand,
221929,Garden Watering Can Decorative Watering Can with Long Spout Durable Watering Can Spill-proof Watering Can for Indoor and Garden Plants,526000.0,249,999,garden-watering-can-decorative-watering-can-with-long-spout-durable-watering-can-spill-proof-watering-can-for-indoor-and-garden-plants,1,5.0,2024-05-01,No brand,
32025,Tuya Smart Video Doorbell Home Peephole Door Camera 1080P Wifi 4.3 Inch HD Night PIR Wireless Call Chime Alexa Doorbell,4856000.0,249,50,tuya-smart-video-doorbell-home-peephole-door-camera-1080p-wifi-4.3-inch-hd-night-pir-wireless-call-chime-alexa-doorbell,1,4.2,2024-05-01,Juniorcare,
222623,1 Mini Watering Machine Indoor Home Garden Vintage Flower Metal Watering Iron Pott,526000.0,249,10,1-mini-watering-machine-indoor-home-garden-vintage-flower-metal-watering-iron-pott,1,2.5,2024-10-20,No brand,
222138,Bird Feeder Metal Container Outdoor Garden Coneflower Bird Feeding Bottle Outdoor Indoor Garden Lawn Decoration,1620000.0,249,90,bird-feeder-metal-container-outdoor-garden-coneflower-bird-feeding-bottle-outdoor-indoor-garden-lawn-decoration,2,4.22,2024-05-07,Alloet,
170789,Crystal Wind Chimes Sun Chasing Pendant Hanging Lamp Catcher Jewelry Wind Chimes For Garden Home Wedding Garden Decoration,786000.0,249,300,crystal-wind-chimes-sun-chasing-pendant-hanging-lamp-catcher-jewelry-wind-chimes-for-garden-home-wedding-garden-decoration,2,4.7,2024-01-21,No brand,
241744,Vintage Pressure Sprayer Garden Plant Flower Water Mist Glass Bottle Watering Pot Home Decor Garden Supplies,1503000.0,249,99,vintage-pressure-sprayer-garden-plant-flower-water-mist-glass-bottle-watering-pot-home-decor-garden-supplies,1,4.0,2024-07-07,No brand,
188957,Window Cleaning Robot Fully Automatic Home High-end Smart Window Double-sided Glass Cleaning and Washing,19017000.0,249,76,window-cleaning-robot-fully-automatic-home-high-end-smart-window-double-sided-glass-cleaning-and-washing,1,4.32,2024-06-28,Saintciaga,
241500,1.2L Gardening Watering Can Flower Pot Watering Home Long Mouth Stainless Steel Curved Mouth Watering Can Gardening Supplies,1389000.0,249,208,1.2l-gardening-watering-can-flower-pot-watering-home-long-mouth-stainless-steel-curved-mouth-watering-can-gardening-supplies,2,4.23,2024-11-06,Aleekit,
194906,European Style Retro Home/Engineering Lawn Lamp Waterproof Outdoor Garden Road Pole E27 Garden Lamp,1669000.0,249,192,european-style-retro-home/engineering-lawn-lamp-waterproof-outdoor-garden-road-pole-e27-garden-lamp,1,3.5,2024-09-07,Ynhaw,
241383,Watering Can for Kids Iron Pot Garden Kettle Flower Pot for Plants Indoor Kids,1622000.0,249,7,watering-can-for-kids-iron-pot-garden-kettle-flower-pot-for-plants-indoor-kids,1,3.88,2024-03-21,No brand,
242019,Praying Cherub Statue Angel Statue Home Garden Decoration,911000.0,249,9,praying-cherub-statue-angel-statue-home-garden-decoration,2,4.0,2024-02-05,No brand,
221334,1L Long Plastic Garden Watering Hose Removable Watering Can Large Capacity Electric Kettle Home Garden Planting Watering,1101000.0,249,10,1l-long-plastic-garden-watering-hose-removable-watering-can-large-capacity-electric-kettle-home-garden-planting-watering,1,5.0,2024-05-24,No brand,
227953,"11 Inch Portable Watering Can Garden Kettle, 2L Watering Can for Watering Indoor Plants or Outdoor Gardening",526000.0,249,500,"11-inch-portable-watering-can-garden-kettle,-2l-watering-can-for-watering-indoor-plants-or-outdoor-gardening",2,4.13,2024-01-21,No brand,
227778,1 Field Hummingbird Feeder Hanging Garden Hummingbird Outdoor Plastic Flower Iron Hook Feeder Yard Window Bird Drinker,1016000.0,249,23,1-field-hummingbird-feeder-hanging-garden-hummingbird-outdoor-plastic-flower-iron-hook-feeder-yard-window-bird-drinker,2,5.0,2024-06-03,No brand,
378778,15.35 X 35.04 X 66.14 American Kitchen Furniture White House 4-Door Microwave Storage Cabinet,12766000.0,249,48,15.35-x-35.04-x-66.14-american-kitchen-furniture-white-house-4-door-microwave-storage-cabinet,2,1.0,2024-02-19,Ruo wu,
189366,Solar Garden Reed String Lights Outdoor Waterproof Light Garden Lights Simulation Landscape Indoor Courtyard Decoration Lights,1657000.0,249,39,solar-garden-reed-string-lights-outdoor-waterproof-light-garden-lights-simulation-landscape-indoor-courtyard-decoration-lights,1,4.22,2024-07-17,No brand,
174634,1Pcs Dwarf Gnome Resin Crafts Home Garden Decoration Ornament Biker Old Man Riding Motorcycle Statue Garden Decoration,2395000.0,249,4994,1pcs-dwarf-gnome-resin-crafts-home-garden-decoration-ornament-biker-old-man-riding-motorcycle-statue-garden-decoration,1,4.17,2024-03-16,No brand,
185002,Halloween solar outdoor garden lights home garden villa decoration street lights stairs floor lights fence wall lights,625000.0,249,500,halloween-solar-outdoor-garden-lights-home-garden-villa-decoration-street-lights-stairs-floor-lights-fence-wall-lights,2,5.0,2024-06-16,Bmad,
187702,Window Door Track Cleaning Brush Gap Sliding Cleaning Tool Kitchen Vacuum Cleaner Handheld Sponge Gap Door Brush Household Tools,526000.0,249,5539,window-door-track-cleaning-brush-gap-sliding-cleaning-tool-kitchen-vacuum-cleaner-handheld-sponge-gap-door-brush-household-tools,2,4.5,2024-01-18,No brand,
264964,50% Shade Garden Plant Shade Sun Shade Outdoor Road Pergola Shade Net Balcony Window Heat Insulation Sun Shade Net,2079000.0,249,10,50%-shade-garden-plant-shade-sun-shade-outdoor-road-pergola-shade-net-balcony-window-heat-insulation-sun-shade-net,2,4.5,2024-01-25,No brand,
206757,Greenhouse Temperature Control Wire Nursery Bed Geothermal Wire Air Soil Heating Cable Garden Plant Heater,526000.0,249,1975,greenhouse-temperature-control-wire-nursery-bed-geothermal-wire-air-soil-heating-cable-garden-plant-heater,2,4.31,2024-09-29,No brand,
216878,Set of 50 Mini Luminous Yellow Ducks Decorative Ducks Miniature Characters Small Ducks Micro Fairy Landscape Fairy Garden Garden Home Decor,638000.0,249,53,set-of-50-mini-luminous-yellow-ducks-decorative-ducks-miniature-characters-small-ducks-micro-fairy-landscape-fairy-garden-garden-home-decor,2,4.71,2024-08-30,No brand,
99388,"1 Shower Curtain With 12 Hooks, Waterproof And Mildew Resistant Shower Curtain, For Window, Room Decor, Home Decor",1512000.0,249,63,"1-shower-curtain-with-12-hooks,-waterproof-and-mildew-resistant-shower-curtain,-for-window,-room-decor,-home-decor",1,0.0,2024-02-20,No brand,
194058,Miniature Artificial Fish Bridge Home Decoration Fairy Garden Crafts DIY Ornament Vintage Mini Garden Decoration Decorarion,987000.0,249,6,miniature-artificial-fish-bridge-home-decoration-fairy-garden-crafts-diy-ornament-vintage-mini-garden-decoration-decorarion,2,4.37,2024-08-12,No brand,
277044,Cat Suncatcher Colored Window Hanging Decoration Acrylic Christmas Sign Hanging For Bedroom Living Room Office Home Decor,698000.0,249,987,cat-suncatcher-colored-window-hanging-decoration-acrylic-christmas-sign-hanging-for-bedroom-living-room-office-home-decor,2,4.2,2024-02-10,No brand,
140590,High-end Fashion-G-Goyards Breathable Bedroom Carpet Kitchen Door Bathroom Super Absorbent Anti-Slip,2810000.0,249,3000,high-end-fashion-g-goyards-breathable-bedroom-carpet-kitchen-door-bathroom-super-absorbent-anti-slip,1,4.16,2024-05-10,No brand,
240443,Shoes Chair Front Door Entryway Chair Designer Cloakroom Sofa Against The Wall Bench End Of Bed,7064000.0,249,1000,shoes-chair-front-door-entryway-chair-designer-cloakroom-sofa-against-the-wall-bench-end-of-bed,1,1.0,2024-04-24,Xplv,
181925,Garden Fence Expandable Screens Privacy Fish Netting Fence Screen Artificial Plants Ivy Leaves Wooden Fence For Garden Home Decor,1566000.0,249,8,garden-fence-expandable-screens-privacy-fish-netting-fence-screen-artificial-plants-ivy-leaves-wooden-fence-for-garden-home-decor,1,3.96,2024-06-12,No brand,
221818,Cute Plastic Elephant Shaped Watering Pot Can Plant Outdoor Irrigation Home Accessories Garden Tools Gardening Equipment Supplies,526000.0,249,8,cute-plastic-elephant-shaped-watering-pot-can-plant-outdoor-irrigation-home-accessories-garden-tools-gardening-equipment-supplies,2,4.36,2024-04-11,No brand,
168437,5-200Pcs Tarpaulin Clips Outdoor Plastic Shade Cloth Clips Garden Building Fence Net Fixing Clips Tarpaulin Hooks Camping Gardening Tools,797000.0,249,9,5-200pcs-tarpaulin-clips-outdoor-plastic-shade-cloth-clips-garden-building-fence-net-fixing-clips-tarpaulin-hooks-camping-gardening-tools,1,4.7,2024-05-27,No brand,
170832,1PC New Dollhouse Glass Miniature Fish Bowl Aquarium Doll House House Decoration Toys For Dollhouse Home Decoration Decals,689000.0,249,20,1pc-new-dollhouse-glass-miniature-fish-bowl-aquarium-doll-house-house-decoration-toys-for-dollhouse-home-decoration-decals,2,4.33,2024-04-27,No brand,
190249,New Glass Cleaning Cloth Wash Brush Magnetic Window Cleaning Double Sided Cleaning Tools Mop,1802000.0,249,95,new-glass-cleaning-cloth-wash-brush-magnetic-window-cleaning-double-sided-cleaning-tools-mop,1,0.0,2024-04-17,No brand,
238086,Artificial Fake Lotus Flower in Pot Wedding Decoration Plants Home Garden Decoration,1630000.0,249,103,artificial-fake-lotus-flower-in-pot-wedding-decoration-plants-home-garden-decoration,1,3.87,2024-03-01,No brand,
379254,"Kitchen Buffet Cabinet, 60” Farmhouse Sliding Door Coffee Barn Cabinet Buffet Cabinet, For Kitchen Dining Room Living Room",10783000.0,249,30,"kitchen-buffet-cabinet,-60”-farmhouse-sliding-door-coffee-barn-cabinet-buffet-cabinet,-for-kitchen-dining-room-living-room",2,5.0,2024-03-21,Ruo wu,
221316,Artistic Iron Vase Vintage Garden Old Flower Pot Making Process Vase Plant Flower Iron Watering Can Pot Kettle Home Garden Decoration,1467000.0,249,983,artistic-iron-vase-vintage-garden-old-flower-pot-making-process-vase-plant-flower-iron-watering-can-pot-kettle-home-garden-decoration,2,1.0,2024-09-22,No brand,
222176,Whale Shape Watering Can Pot Home Garden Flower Tools Sundew Gardening Pot Water Plants Watering Can Kids Bath Toys,1211000.0,249,999,whale-shape-watering-can-pot-home-garden-flower-tools-sundew-gardening-pot-water-plants-watering-can-kids-bath-toys,1,1.0,2024-08-06,Tpxckz,
280479,Double Sided Shop Sign Kid Room Decor Welcome Sign Listing Front Door Decoration Hanging Outdoor Porch Wood,1210000.0,249,16,double-sided-shop-sign-kid-room-decor-welcome-sign-listing-front-door-decoration-hanging-outdoor-porch-wood,2,5.0,2024-05-24,No brand,
182127,Glass Bottle Mini Aquarium Fish For Flower Shop Sales Field Desktop Hanging Crystal Home Decoration Ornament,903000.0,249,50,glass-bottle-mini-aquarium-fish-for-flower-shop-sales-field-desktop-hanging-crystal-home-decoration-ornament,2,4.27,2024-05-13,No brand,
124337,Smart Video Doorbell Wired Home Peephole Tuya Camera App 1080P WiFi 4.3 Inch HD Night PIR Wireless Call Alexa Doorbell,13131000.0,249,0,smart-video-doorbell-wired-home-peephole-tuya-camera-app-1080p-wifi-4.3-inch-hd-night-pir-wireless-call-alexa-doorbell,1,3.8,2024-05-01,Juniorcare,
100588,Blue Square Green Home Decor Bathroom Waterproof Shower Curtain PEVA Printed Modern Shower Curtain,1170000.0,249,28,blue-square-green-home-decor-bathroom-waterproof-shower-curtain-peva-printed-modern-shower-curtain,1,0.0,2024-10-17,No brand,
222292,Indoor Watering Can Decorative Flower Watering Can with Long Spout Semi-Open Garden Provide durable watering cans for the home,526000.0,249,999,indoor-watering-can-decorative-flower-watering-can-with-long-spout-semi-open-garden-provide-durable-watering-cans-for-the-home,1,4.29,2024-01-10,No brand,
170468,"Mini Scarecrow Fall Decoration, 3 Pack Scarecrows for Garden, Home, Yard, Porch, Halloween Thanksgiving Decoration",797000.0,249,25,"mini-scarecrow-fall-decoration,-3-pack-scarecrows-for-garden,-home,-yard,-porch,-halloween-thanksgiving-decoration",2,5.0,2024-06-21,No brand,
99341,Selling Adhesive With Storage Rack Bathroom Accessories Corner Kitchen Shelf Bathroom Home Decoration 3 Colors,526000.0,249,67,selling-adhesive-with-storage-rack-bathroom-accessories-corner-kitchen-shelf-bathroom-home-decoration-3-colors,1,0.0,2024-04-15,No brand,
181727,Indoor Planter Clear Glass Standing Flower Plant Hanging Vase Ball Terrarium Container for Garden and Home Decor,824000.0,249,32,indoor-planter-clear-glass-standing-flower-plant-hanging-vase-ball-terrarium-container-for-garden-and-home-decor,2,5.0,2024-08-29,Faroot,
222388,2L Capacity Watering Can Pot Long Spout Electric Kettle Indoor Outdoor Home Garden Plant Flower Ornamental Plant Succulent Flower Growing,2295000.0,249,999,2l-capacity-watering-can-pot-long-spout-electric-kettle-indoor-outdoor-home-garden-plant-flower-ornamental-plant-succulent-flower-growing,1,4.29,2024-05-04,Vibratite,
155846,Mini Resin Aquarium Old Fish Fishing Man Figure Home Landscape Decoration Miniature Garden Pot Dollhouse Decoration Ornament,664000.0,249,999,mini-resin-aquarium-old-fish-fishing-man-figure-home-landscape-decoration-miniature-garden-pot-dollhouse-decoration-ornament,2,4.27,2024-08-30,No brand,
142940,Mini Resin Aquarium Old Fish Fishing Man Figure Home Landscape Decoration Miniature Garden Pot Dollhouse Decoration Ornament,770000.0,249,123,mini-resin-aquarium-old-fish-fishing-man-figure-home-landscape-decoration-miniature-garden-pot-dollhouse-decoration-ornament,2,4.1,2024-01-20,No brand,
182419,Creative Soft Glass Scraper Squeegee Window Wiper Brush Dust Squeegee For Car Window Washing Kitchen Bathroom Tools,1190000.0,249,501,creative-soft-glass-scraper-squeegee-window-wiper-brush-dust-squeegee-for-car-window-washing-kitchen-bathroom-tools,2,4.0,2024-07-18,No brand,
182107,Retractable Expandable Wooden Garden Wall Fence Panel Climbing Plant Trellis Support Garden Decoration Fencing For Yard Home Decor,1755000.0,249,8,retractable-expandable-wooden-garden-wall-fence-panel-climbing-plant-trellis-support-garden-decoration-fencing-for-yard-home-decor,2,4.26,2024-01-03,No brand,
180489,New Garden Screening Trellis Extension Privacy Screen Artificial Fence Fake Ivy Leaves Wooden Fence for Garden Buildings,526000.0,249,175,new-garden-screening-trellis-extension-privacy-screen-artificial-fence-fake-ivy-leaves-wooden-fence-for-garden-buildings,2,4.34,2024-06-19,No brand,
194018,"0.32mm PE Tarpaulin Rainproof Outdoor Fabric Garden Plant House Shelter Boat Car, Truck Canopy Waterproof Sunscreen Fabric Pet House Cover",6011000.0,249,9995,"0.32mm-pe-tarpaulin-rainproof-outdoor-fabric-garden-plant-house-shelter-boat-car,-truck-canopy-waterproof-sunscreen-fabric-pet-house-cover",1,4.19,2024-06-25,Sgoohan,
145984,Purple Clay Aquarium Ornament Decorative Accessories Pet Fish House Shelter Fairy Garden Home Decor,764000.0,249,4,purple-clay-aquarium-ornament-decorative-accessories-pet-fish-house-shelter-fairy-garden-home-decor,2,4.83,2024-10-29,No brand,
169185,1-3Pcs Solar Powered Dancing Vibrating Butterfly Garden Decoration Flying Hummingbird Garden Yard Outdoor Home Decoration Agricultural Land,526000.0,249,29,1-3pcs-solar-powered-dancing-vibrating-butterfly-garden-decoration-flying-hummingbird-garden-yard-outdoor-home-decoration-agricultural-land,1,3.77,2024-02-05,Huan-qzta,
170737,1/12 Dollhouse Miniature Glass Aquarium Bowl Simulation Micro Landscape Bowl Aquarium Accessories Dollhouse Home Decoration,834000.0,249,999,1/12-dollhouse-miniature-glass-aquarium-bowl-simulation-micro-landscape-bowl-aquarium-accessories-dollhouse-home-decoration,1,4.21,2024-10-17,No brand,
374377,White finished wooden kitchen cabinet with glass doors,8883000.0,249,10,white-finished-wooden-kitchen-cabinet-with-glass-doors,2,4.12,2024-09-29,No brand,
226486,Wooden Music Box Retro Camera Classic Design Birthday Home Decoration Dropshipping,2172000.0,249,6,wooden-music-box-retro-camera-classic-design-birthday-home-decoration-dropshipping,2,4.16,2024-08-20,Ootdty,
